{
  "$schema": "https://json-schema.org/draft/2020-12/schema",
  "$id": "stepmeld/run-request.v1",
  "title": "request.json in a run directory: what the Performer hands a program to start one Run. Written once, before the program starts; the program only reads it.",
  "type": "object",
  "required": [
    "workflow",
    "step",
    "run",
    "definition",
    "inputs",
    "parameters",
    "outputs"
  ],
  "additionalProperties": false,
  "properties": {
    "workflow": {
      "type": "string",
      "minLength": 1
    },
    "step": {
      "$ref": "#/$defs/name"
    },
    "run": {
      "type": "string",
      "minLength": 1,
      "description": "The Run's id. A Performer asked twice for the same Run starts one program."
    },
    "definition": {
      "$ref": "#/$defs/ref",
      "description": "The verb: a program may perform several and picks by name."
    },
    "program": {
      "type": "string",
      "description": "The program the StepDefinition names; a Worker runs the command it registered under that name."
    },
    "inputs": {
      "type": "object",
      "description": "Every Input that holds a Value, by name. Values are opaque JSON."
    },
    "parameters": {
      "type": "object",
      "description": "Every Parameter in effect (the verb's default where no Actor chose), by name."
    },
    "outputs": {
      "type": "array",
      "description": "What a success must produce: each declared Output, by name and tag.",
      "items": {
        "type": "object",
        "required": [
          "name",
          "tag"
        ],
        "additionalProperties": false,
        "properties": {
          "name": {
            "$ref": "#/$defs/port"
          },
          "tag": {
            "$ref": "#/$defs/tag"
          },
          "options": {
            "type": "array",
            "minItems": 1,
            "items": {
              "type": "string"
            },
            "description": "Present on a Decision (tag `decision`): the words its Value may be."
          },
          "label": {
            "type": "string"
          }
        }
      }
    }
  },
  "$defs": {
    "ref": {
      "type": "object",
      "required": [
        "name",
        "version"
      ],
      "additionalProperties": false,
      "properties": {
        "name": {
          "type": "string"
        },
        "version": {
          "type": "integer",
          "minimum": 1
        }
      }
    },
    "name": {
      "type": "string",
      "pattern": "^[^.\\s]+$",
      "description": "No dots: names are joined with ports by a dot."
    },
    "port": {
      "type": "string",
      "minLength": 1
    },
    "tag": {
      "type": "string",
      "minLength": 1,
      "description": "An opaque label, compared for equality."
    }
  }
}
